{
  "task_name": "测试do-not-be-wrong图片替换 (random_01)",
  "task_id": "test_do_not_be_wrong_20251005_173000",
  "created_at": "2025-10-05T17:30:00Z",
  "page_config": {
    "page_path": "do-not-be-wrong",
    "page_url": "http://localhost:3003/do-not-be-wrong",
    "css_selector": ".spotImage",
    "page_width": 1440,
    "page_height": 1920
  },
  "input_files": [
    {"json_file": "input/明红/图片URL/随机组合/模板4/random_01_20251005_162425.json", "output_name": "test-do-not-be-wrong-random01"}
  ],
  "output_config": {
    "output_dir": "output/model",
    "screenshot_format": "png",
    "clip_to_viewport": true,
    "auto_dimensions": false
  },
  "execution_config": {
    "headless": false,
    "wait_after_replace": 5,
    "timeout": 60000
  }
}
